{
  "objectId": "7d9e4f30-a2c5-4b18-9e0f-04c8b2a61006",
  "ownerScopeId": "8c4b21aa-35de-4f60-9c17-2b8e40d5a002",
  "localName": "RuntimeNameMap-IRBot6",
  "objectRevision": 1,
  "createdAt": "2026-08-29T08:12:41Z",
  "provenance": {
    "importOrigin": "OtherInput",
    "sourceDetail": "generated by the model compiler from RobotDesign rev-000007"
  },
  "schemaVersion": 1,
  "compilerVersion": "0.1.0",
  "robotDeviceName": "IRBot6",
  "bindings": [
    {
      "objectId": "8c4b21aa-35de-4f60-9c17-2b8e40d5a002",
      "ownerScopeId": "8c4b21aa-35de-4f60-9c17-2b8e40d5a002",
      "localName": "IRBot6",
      "runtimeDeviceName": "IRBot6",
      "runtimeScopedName": "IRBot6.Device",
      "objectKind": "Device"
    },
    {
      "objectId": "aa100000-0000-4000-8000-000000000001",
      "ownerScopeId": "8c4b21aa-35de-4f60-9c17-2b8e40d5a002",
      "localName": "Joint1",
      "runtimeDeviceName": "IRBot6",
      "runtimeScopedName": "IRBot6.Joint1",
      "objectKind": "Joint"
    },
    {
      "objectId": "aa100000-0000-4000-8000-000000000002",
      "ownerScopeId": "8c4b21aa-35de-4f60-9c17-2b8e40d5a002",
      "localName": "Joint2",
      "runtimeDeviceName": "IRBot6",
      "runtimeScopedName": "IRBot6.Joint2",
      "objectKind": "Joint"
    },
    {
      "objectId": "aa100000-0000-4000-8000-000000000003",
      "ownerScopeId": "8c4b21aa-35de-4f60-9c17-2b8e40d5a002",
      "localName": "Joint3",
      "runtimeDeviceName": "IRBot6",
      "runtimeScopedName": "IRBot6.Joint3",
      "objectKind": "Joint"
    },
    {
      "objectId": "aa100000-0000-4000-8000-000000000004",
      "ownerScopeId": "8c4b21aa-35de-4f60-9c17-2b8e40d5a002",
      "localName": "Joint4",
      "runtimeDeviceName": "IRBot6",
      "runtimeScopedName": "IRBot6.Joint4",
      "objectKind": "Joint"
    },
    {
      "objectId": "aa100000-0000-4000-8000-000000000005",
      "ownerScopeId": "8c4b21aa-35de-4f60-9c17-2b8e40d5a002",
      "localName": "Joint5",
      "runtimeDeviceName": "IRBot6",
      "runtimeScopedName": "IRBot6.Joint5",
      "objectKind": "Joint"
    },
    {
      "objectId": "aa100000-0000-4000-8000-000000000006",
      "ownerScopeId": "8c4b21aa-35de-4f60-9c17-2b8e40d5a002",
      "localName": "Joint6",
      "runtimeDeviceName": "IRBot6",
      "runtimeScopedName": "IRBot6.Joint6",
      "objectKind": "Joint"
    },
    {
      "objectId": "bb200000-0000-4000-8000-000000000002",
      "ownerScopeId": "8c4b21aa-35de-4f60-9c17-2b8e40d5a002",
      "localName": "UpperArm",
      "runtimeDeviceName": "IRBot6",
      "runtimeScopedName": "IRBot6.UpperArm",
      "objectKind": "Link"
    },
    {
      "objectId": "e77b3c50-9a1d-4f62-8b04-35c9d0e7a70a",
      "ownerScopeId": "8c4b21aa-35de-4f60-9c17-2b8e40d5a002",
      "localName": "tcp-default",
      "runtimeDeviceName": "IRBot6",
      "runtimeScopedName": "IRBot6.tcp-default",
      "objectKind": "Frame"
    }
  ]
}
